{
  "schema_version": "LineageNode.v1",
  "node_id": "node:fake-producer-run:0001",
  "node_type": "fake_producer_run",
  "payload_schema_id": "fake_producer_run",
  "payload_schema_version": "v1",
  "payload": {
    "schema_version": "fake_producer_run.v1",
    "run_id": "run:fake-producer:0001",
    "started_at": "2026-05-04T15:00:00Z",
    "completed_at": "2026-05-04T15:00:05Z",
    "label": "phase05-proof-run"
  },
  "payload_hash": "0000000000000000000000000000000000000000000000000000000000000000",
  "source_system": "fake-producer",
  "source_component": "fake-producer/runner",
  "trace_id": "trace:phase05:0001",
  "idempotency_key": "idem:fake-producer:run:0001",
  "writer_identity": "fake-producer",
  "recorded_at": "2026-05-04T15:00:05Z",
  "validation_status": "accepted"
}
